{
  "record_type": "cam_assist_manufacturing_assumptions",
  "record_version": "1.0.0",
  "package_reference": "luthiers-toolbox:vcarve:les-paul-custom-2024",
  "created_at": "2026-06-14T20:18:05.242334Z",
  "assumptions": [
    {
      "category": "tooling",
      "statement": "Tool rigidity is adequate for selected depth of cut."
    },
    {
      "category": "material",
      "statement": "Material certification supplied by customer."
    }
  ],
  "authority": {
    "is_informational": true,
    "does_not_authorize_execution": true,
    "does_not_bypass_human_review": true
  }
}
